[{
  "data": {
    "heading": "E",
    "men": 15,
    "contracts": [
      {
        "amount": 2,
        "resource": "GLASS"
      },
      {
        "amount": 15,
        "resource": "RUM"
      },
      {
        "amount": 100,
        "resource": "FRUITS"
      },
      {
        "amount": 500,
        "resource": "FLOWER"
      },
      {
        "amount": 12000,
        "resource": "WOOD"
      },
      {
        "amount": 2000,
        "resource": "FUR"
      }
    ],
    "budget": 40000
  },
  "part": "Engine",
  "time": 1488737658802,
  "meth": "initialize"
},{
  "data": {
    "action": "echo",
    "parameters": {"direction": "E"}
  },
  "part": "Explorer",
  "time": 1488737658810,
  "meth": "takeDecision"
},{
  "data": {
    "cost": 4,
    "extras": {
      "found": "OUT_OF_RANGE",
      "range": 52
    },
    "status": "OK"
  },
  "part": "Engine",
  "time": 1488737658810,
  "meth": "takeDecision"
},{
  "data": {
    "action": "echo",
    "parameters": {"direction": "N"}
  },
  "part": "Explorer",
  "time": 1488737658810,
  "meth": "takeDecision"
},{
  "data": {
    "cost": 5,
    "extras": {
      "found": "OUT_OF_RANGE",
      "range": 0
    },
    "status": "OK"
  },
  "part": "Engine",
  "time": 1488737658810,
  "meth": "takeDecision"
},{
  "data": {
    "action": "echo",
    "parameters": {"direction": "S"}
  },
  "part": "Explorer",
  "time": 1488737658811,
  "meth": "takeDecision"
},{
  "data": {
    "cost": 5,
    "extras": {
      "found": "OUT_OF_RANGE",
      "range": 52
    },
    "status": "OK"
  },
  "part": "Engine",
  "time": 1488737658811,
  "meth": "takeDecision"
},{
  "data": {
    "action": "echo",
    "parameters": {"direction": "N"}
  },
  "part": "Explorer",
  "time": 1488737658813,
  "meth": "takeDecision"
},{
  "data": {
    "cost": 4,
    "extras": {
      "found": "OUT_OF_RANGE",
      "range": 0
    },
    "status": "OK"
  },
  "part": "Engine",
  "time": 1488737658813,
  "meth": "takeDecision"
},{
  "data": {
    "action": "echo",
    "parameters": {"direction": "S"}
  },
  "part": "Explorer",
  "time": 1488737658813,
  "meth": "takeDecision"
},{
  "data": {
    "cost": 4,
    "extras": {
      "found": "OUT_OF_RANGE",
      "range": 52
    },
    "status": "OK"
  },
  "part": "Engine",
  "time": 1488737658813,
  "meth": "takeDecision"
},{
  "data": {"action": "fly"},
  "part": "Explorer",
  "time": 1488737658813,
  "meth": "takeDecision"
},{
  "data": {
    "cost": 3,
    "extras": {},
    "status": "OK"
  },
  "part": "Engine",
  "time": 1488737658813,
  "meth": "takeDecision"
},{
  "data": {
    "action": "echo",
    "parameters": {"direction": "N"}
  },
  "part": "Explorer",
  "time": 1488737658813,
  "meth": "takeDecision"
},{
  "data": {
    "cost": 5,
    "extras": {
      "found": "OUT_OF_RANGE",
      "range": 0
    },
    "status": "OK"
  },
  "part": "Engine",
  "time": 1488737658813,
  "meth": "takeDecision"
},{
  "data": {
    "action": "echo",
    "parameters": {"direction": "S"}
  },
  "part": "Explorer",
  "time": 1488737658813,
  "meth": "takeDecision"
},{
  "data": {
    "cost": 7,
    "extras": {
      "found": "OUT_OF_RANGE",
      "range": 52
    },
    "status": "OK"
  },
  "part": "Engine",
  "time": 1488737658814,
  "meth": "takeDecision"
},{
  "data": {"action": "fly"},
  "part": "Explorer",
  "time": 1488737658814,
  "meth": "takeDecision"
},{
  "data": {
    "cost": 4,
    "extras": {},
    "status": "OK"
  },
  "part": "Engine",
  "time": 1488737658814,
  "meth": "takeDecision"
},{
  "data": {
    "action": "echo",
    "parameters": {"direction": "N"}
  },
  "part": "Explorer",
  "time": 1488737658814,
  "meth": "takeDecision"
},{
  "data": {
    "cost": 4,
    "extras": {
      "found": "OUT_OF_RANGE",
      "range": 0
    },
    "status": "OK"
  },
  "part": "Engine",
  "time": 1488737658814,
  "meth": "takeDecision"
},{
  "data": {
    "action": "echo",
    "parameters": {"direction": "S"}
  },
  "part": "Explorer",
  "time": 1488737658814,
  "meth": "takeDecision"
},{
  "data": {
    "cost": 5,
    "extras": {
      "found": "OUT_OF_RANGE",
      "range": 52
    },
    "status": "OK"
  },
  "part": "Engine",
  "time": 1488737658814,
  "meth": "takeDecision"
},{
  "data": {"action": "fly"},
  "part": "Explorer",
  "time": 1488737658814,
  "meth": "takeDecision"
},{
  "data": {
    "cost": 3,
    "extras": {},
    "status": "OK"
  },
  "part": "Engine",
  "time": 1488737658814,
  "meth": "takeDecision"
},{
  "data": {
    "action": "echo",
    "parameters": {"direction": "N"}
  },
  "part": "Explorer",
  "time": 1488737658814,
  "meth": "takeDecision"
},{
  "data": {
    "cost": 6,
    "extras": {
      "found": "OUT_OF_RANGE",
      "range": 0
    },
    "status": "OK"
  },
  "part": "Engine",
  "time": 1488737658814,
  "meth": "takeDecision"
},{
  "data": {
    "action": "echo",
    "parameters": {"direction": "S"}
  },
  "part": "Explorer",
  "time": 1488737658814,
  "meth": "takeDecision"
},{
  "data": {
    "cost": 6,
    "extras": {
      "found": "GROUND",
      "range": 33
    },
    "status": "OK"
  },
  "part": "Engine",
  "time": 1488737658815,
  "meth": "takeDecision"
},{
  "data": {
    "action": "heading",
    "parameters": {"direction": "S"}
  },
  "part": "Explorer",
  "time": 1488737658815,
  "meth": "takeDecision"
},{
  "data": {
    "cost": 4,
    "extras": {},
    "status": "OK"
  },
  "part": "Engine",
  "time": 1488737658815,
  "meth": "takeDecision"
},{
  "data": {"action": "fly"},
  "part": "Explorer",
  "time": 1488737658816,
  "meth": "takeDecision"
},{
  "data": {
    "cost": 4,
    "extras": {},
    "status": "OK"
  },
  "part": "Engine",
  "time": 1488737658816,
  "meth": "takeDecision"
},{
  "data": {"action": "fly"},
  "part": "Explorer",
  "time": 1488737658816,
  "meth": "takeDecision"
},{
  "data": {
    "cost": 6,
    "extras": {},
    "status": "OK"
  },
  "part": "Engine",
  "time": 1488737658816,
  "meth": "takeDecision"
},{
  "data": {"action": "fly"},
  "part": "Explorer",
  "time": 1488737658816,
  "meth": "takeDecision"
},{
  "data": {
    "cost": 4,
    "extras": {},
    "status": "OK"
  },
  "part": "Engine",
  "time": 1488737658816,
  "meth": "takeDecision"
},{
  "data": {"action": "fly"},
  "part": "Explorer",
  "time": 1488737658816,
  "meth": "takeDecision"
},{
  "data": {
    "cost": 3,
    "extras": {},
    "status": "OK"
  },
  "part": "Engine",
  "time": 1488737658816,
  "meth": "takeDecision"
},{
  "data": {"action": "fly"},
  "part": "Explorer",
  "time": 1488737658816,
  "meth": "takeDecision"
},{
  "data": {
    "cost": 6,
    "extras": {},
    "status": "OK"
  },
  "part": "Engine",
  "time": 1488737658816,
  "meth": "takeDecision"
},{
  "data": {"action": "fly"},
  "part": "Explorer",
  "time": 1488737658816,
  "meth": "takeDecision"
},{
  "data": {
    "cost": 2,
    "extras": {},
    "status": "OK"
  },
  "part": "Engine",
  "time": 1488737658816,
  "meth": "takeDecision"
},{
  "data": {"action": "fly"},
  "part": "Explorer",
  "time": 1488737658816,
  "meth": "takeDecision"
},{
  "data": {
    "cost": 2,
    "extras": {},
    "status": "OK"
  },
  "part": "Engine",
  "time": 1488737658816,
  "meth": "takeDecision"
},{
  "data": {"action": "fly"},
  "part": "Explorer",
  "time": 1488737658816,
  "meth": "takeDecision"
},{
  "data": {
    "cost": 4,
    "extras": {},
    "status": "OK"
  },
  "part": "Engine",
  "time": 1488737658816,
  "meth": "takeDecision"
},{
  "data": {"action": "fly"},
  "part": "Explorer",
  "time": 1488737658816,
  "meth": "takeDecision"
},{
  "data": {
    "cost": 5,
    "extras": {},
    "status": "OK"
  },
  "part": "Engine",
  "time": 1488737658816,
  "meth": "takeDecision"
},{
  "data": {"action": "fly"},
  "part": "Explorer",
  "time": 1488737658816,
  "meth": "takeDecision"
},{
  "data": {
    "cost": 4,
    "extras": {},
    "status": "OK"
  },
  "part": "Engine",
  "time": 1488737658816,
  "meth": "takeDecision"
},{
  "data": {"action": "fly"},
  "part": "Explorer",
  "time": 1488737658816,
  "meth": "takeDecision"
},{
  "data": {
    "cost": 6,
    "extras": {},
    "status": "OK"
  },
  "part": "Engine",
  "time": 1488737658816,
  "meth": "takeDecision"
},{
  "data": {"action": "fly"},
  "part": "Explorer",
  "time": 1488737658816,
  "meth": "takeDecision"
},{
  "data": {
    "cost": 2,
    "extras": {},
    "status": "OK"
  },
  "part": "Engine",
  "time": 1488737658816,
  "meth": "takeDecision"
},{
  "data": {"action": "fly"},
  "part": "Explorer",
  "time": 1488737658816,
  "meth": "takeDecision"
},{
  "data": {
    "cost": 4,
    "extras": {},
    "status": "OK"
  },
  "part": "Engine",
  "time": 1488737658816,
  "meth": "takeDecision"
},{
  "data": {"action": "fly"},
  "part": "Explorer",
  "time": 1488737658816,
  "meth": "takeDecision"
},{
  "data": {
    "cost": 3,
    "extras": {},
    "status": "OK"
  },
  "part": "Engine",
  "time": 1488737658816,
  "meth": "takeDecision"
},{
  "data": {"action": "fly"},
  "part": "Explorer",
  "time": 1488737658816,
  "meth": "takeDecision"
},{
  "data": {
    "cost": 3,
    "extras": {},
    "status": "OK"
  },
  "part": "Engine",
  "time": 1488737658816,
  "meth": "takeDecision"
},{
  "data": {"action": "fly"},
  "part": "Explorer",
  "time": 1488737658817,
  "meth": "takeDecision"
},{
  "data": {
    "cost": 4,
    "extras": {},
    "status": "OK"
  },
  "part": "Engine",
  "time": 1488737658817,
  "meth": "takeDecision"
},{
  "data": {"action": "fly"},
  "part": "Explorer",
  "time": 1488737658817,
  "meth": "takeDecision"
},{
  "data": {
    "cost": 4,
    "extras": {},
    "status": "OK"
  },
  "part": "Engine",
  "time": 1488737658817,
  "meth": "takeDecision"
},{
  "data": {"action": "fly"},
  "part": "Explorer",
  "time": 1488737658817,
  "meth": "takeDecision"
},{
  "data": {
    "cost": 4,
    "extras": {},
    "status": "OK"
  },
  "part": "Engine",
  "time": 1488737658817,
  "meth": "takeDecision"
},{
  "data": {"action": "fly"},
  "part": "Explorer",
  "time": 1488737658817,